Gum Disease,http://author.crest.pgsitecore.com/en-us/oral-care-topics/gum-diseasesDental Emergencies - What to Do,http://author.crest.pgsitecore.com/en-us/oral-care-topics/dental-emergencies-what-to-doShould I Worry If My Teeth Have Sensitivity to Cold,http://author.crest.pgsitecore.com/en-us/oral-care-topics/should-i-worry-if-my-teeth-have-sensitivity-to-coldWhat you Should Know About Sensitive Teeth,http://author.crest.pgsitecore.com/en-us/oral-care-topics/what-you-should-know-about-sensitive-teethDefine Your Dental Pain,http://author.crest.pgsitecore.com/en-us/oral-care-topics/define-your-dental-painDont Ignore Gum Inflammation,http://author.crest.pgsitecore.com/en-us/oral-care-topics/dont-ignore-gum-inflammationDiagnosing Teeth Sensitive to Hot and Cold,http://author.crest.pgsitecore.com/en-us/oral-care-topics/diagnosing-teeth-sensitive-to-hot-and-coldStopping Tooth Ache Pain,http://author.crest.pgsitecore.com/en-us/oral-care-topics/stopping-tooth-ache-painHelp for Extremely Sensitive Teeth,http://author.crest.pgsitecore.com/en-us/oral-care-topics/help-for-extremely-sensitive-teethSneaky Sources of Tooth Pain,http://author.crest.pgsitecore.com/en-us/oral-care-topics/sneaky-sources-of-tooth-painWhat to Know about Root Canal Pain,http://author.crest.pgsitecore.com/en-us/oral-care-topics/what-to-know-about-root-canal-painWhat to Expect from a Tooth Extraction,http://author.crest.pgsitecore.com/en-us/oral-care-topics/what-to-expect-from-a-tooth-extractionMajor Causes of Tooth Pain,http://author.crest.pgsitecore.com/en-us/oral-care-topics/major-causes-of-tooth-painBaking Soda for Brushing Teeth - Pros & Cons,http://author.crest.pgsitecore.com/en-us/oral-care-topics/baking-soda-for-brushing-teeth-pros-consSinus Infection Tooth Pain Might Lead to Tooth Decay,http://author.crest.pgsitecore.com/en-us/oral-care-topics/sinus-infection-tooth-pain-might-lead-to-tooth-decayFinding the Best Toothpaste for Sensitive Teeth,http://author.crest.pgsitecore.com/en-us/oral-care-topics/finding-the-best-toothpaste-for-sensitive-teethGum Disease Symptoms,http://author.crest.pgsitecore.com/en-us/oral-care-topics/gum-disease-symptomsTeeth Sensitivity,http://author.crest.pgsitecore.com/en-us/oral-care-topics/teeth-sensitivityCleaning Teeth Cheat Sheet,http://author.crest.pgsitecore.com/en-us/oral-care-topics/cleaning-teeth-cheat-sheetEverything You Need to Know about a Cavity,http://author.crest.pgsitecore.com/en-us/oral-care-topics/everything-you-need-to-know-about-a-cavityToothbrushing Technique to Prevent Teeth Sensitivity,http://author.crest.pgsitecore.com/en-us/oral-care-topics/toothbrushing-technique-to-prevent-teeth-sensitivityGum Infection - Treatment & Prevention,http://author.crest.pgsitecore.com/en-us/oral-care-topics/gum-infection-treatment-preventionDental Abscess Awareness What You Need to Know,http://author.crest.pgsitecore.com/en-us/oral-care-topics/dental-abscess-awareness-what-you-need-to-knowKids Dental Care,http://author.crest.pgsitecore.com/en-us/oral-care-topics/kidsCavity Prevention for Babies,http://author.crest.pgsitecore.com/en-us/oral-care-topics/cavity-prevention-for-babiesGet Kids Excited to Fight Cavities,http://author.crest.pgsitecore.com/en-us/oral-care-topics/get-kids-excited-to-fight-cavities