Gum Disease,http://author.crest.pgsitecore.com/en-us/oral-care-topics/gum-diseasesTreating Painful Infected Gums,http://author.crest.pgsitecore.com/en-us/oral-care-topics/treating-painful-infected-gumsSwollen Gums Care,http://author.crest.pgsitecore.com/en-us/oral-care-topics/swollen-gums-careWhat Causes Painful Gums,http://author.crest.pgsitecore.com/en-us/oral-care-topics/what-causes-painful-gumsWarning Signs of Gum Disease,http://author.crest.pgsitecore.com/en-us/oral-care-topics/warning-signs-of-gum-diseaseHow to Help Stop Gum Disease Before It Starts,http://author.crest.pgsitecore.com/en-us/oral-care-topics/how-to-help-stop-gum-disease-before-it-startsFinding Relief from Swollen Painful Gums,http://author.crest.pgsitecore.com/en-us/oral-care-topics/finding-relief-from-swollen-painful-gumsWhitening,http://author.crest.pgsitecore.com/en-us/oral-care-topics/whiteningTeeth Whitening Kits Results,http://author.crest.pgsitecore.com/en-us/oral-care-topics/teeth-whitening-kits-resultsSafe Teeth Whitening at Home,http://author.crest.pgsitecore.com/en-us/oral-care-topics/safe-teeth-whitening-at-homeMix Up Your Regimen with These Teeth Whitening Products,http://author.crest.pgsitecore.com/en-us/oral-care-topics/mix-up-your-regimen-with-these-teeth-whitening-productsSmile and Get Started with Professional Teeth Whitening,http://author.crest.pgsitecore.com/en-us/oral-care-topics/smile-and-get-started-with-professional-teeth-whiteningFinding a Reliable Source of Teeth Whitening Information,http://author.crest.pgsitecore.com/en-us/oral-care-topics/finding-a-reliable-source-of-teeth-whitening-informationHow to Whiten Yellow Teeth and Protect Against Future Stains,http://author.crest.pgsitecore.com/en-us/oral-care-topics/how-to-whiten-yellow-teeth-and-protect-against-future-stainsChoosing the Best Over the Counter Teeth Whitening Systems,http://author.crest.pgsitecore.com/en-us/oral-care-topics/choosing-the-best-over-the-counter-teeth-whitening-systemsKnow the Types of Tooth Stain,http://author.crest.pgsitecore.com/en-us/oral-care-topics/know-the-types-of-tooth-stainStoring Tooth Whitening Kits,http://author.crest.pgsitecore.com/en-us/oral-care-topics/storing-tooth-whitening-kitsTeeth Whitening Techniques for a Brighter Smile on a Budget,http://author.crest.pgsitecore.com/en-us/oral-care-topics/teeth-whitening-techniques-for-a-brighter-smile-on-a-budgetFinding the Best Teeth Whitening Kits,http://author.crest.pgsitecore.com/en-us/oral-care-topics/finding-the-best-teeth-whitening-kitsThe Best Way to Whiten Teeth at Home,http://author.crest.pgsitecore.com/en-us/oral-care-topics/the-best-way-to-whiten-teeth-at-homeCitrus as a Natural Tooth Whitener Is it Effective,http://author.crest.pgsitecore.com/en-us/oral-care-topics/citrus-as-a-natural-tooth-whitener-is-it-effectiveHow Much Does Teeth Whitening Cost,http://author.crest.pgsitecore.com/en-us/oral-care-topics/how-much-does-teeth-whitening-costBest Teeth Whitening Systems,http://author.crest.pgsitecore.com/en-us/oral-care-topics/best-teeth-whitening-systemsTeeth Whitening Trays,http://author.crest.pgsitecore.com/en-us/oral-care-topics/teeth-whitening-traysMake a Plan for the Cost of Teeth Whitening,http://author.crest.pgsitecore.com/en-us/oral-care-topics/make-a-plan-for-the-cost-of-teeth-whiteningUnderstanding the Safety of Teeth Whitening,http://author.crest.pgsitecore.com/en-us/oral-care-topics/understanding-the-safety-of-teeth-whiteningOptions for Tooth Whitening at Home,http://author.crest.pgsitecore.com/en-us/oral-care-topics/options-for-tooth-whitening-at-homeDo It Yourself Teeth Whitening,http://author.crest.pgsitecore.com/en-us/oral-care-topics/do-it-yourself-teeth-whiteningKeep Your Teeth Whitening Cost Under Control,http://author.crest.pgsitecore.com/en-us/oral-care-topics/keep-your-teeth-whitening-cost-under-controlImprove Teeth Discoloration,http://author.crest.pgsitecore.com/en-us/oral-care-topics/improve-teeth-discolorationThe Best Teeth Stain Removal Options for Teeth Sensitive to Whitening,http://author.crest.pgsitecore.com/en-us/oral-care-topics/the-best-teeth-stain-removal-options-for-teeth-sensitive-to-whiteningFinally A Home Teeth Whitener for Teeth Sensitive to Whitening,http://author.crest.pgsitecore.com/en-us/oral-care-topics/finally-a-home-teeth-whitener-for-teeth-sensitive-to-whiteningTop Dental Hygiene Products to Keep on Hand for a Bright Smile,http://author.crest.pgsitecore.com/en-us/oral-care-topics/top-dental-hygiene-products-to-keep-on-hand-for-a-bright-smileTooth Whitening Safety - The Safe Way to a Whiter Smile,http://author.crest.pgsitecore.com/en-us/oral-care-topics/tooth-whitening-safety---the-safe-way-to-a-whiter-smileNatural Teeth Whitening with Hydrogen Peroxide - Is It Effective?,http://author.crest.pgsitecore.com/en-us/oral-care-topics/natural-teeth-whitening-with-hydrogen-peroxide-is-it-effectiveBenefits of Teeth Whitening at Home,http://author.crest.pgsitecore.com/en-us/oral-care-topics/benefits-of-teeth-whitening-at-homeEvaluating Home Tooth Whitening Kits,http://author.crest.pgsitecore.com/en-us/oral-care-topics/evaluating-home-tooth-whitening-kitsWhy Buy Teeth Whitening Kits,http://author.crest.pgsitecore.com/en-us/oral-care-topics/why-buy-teeth-whitening-kitsBrown Teeth Causes,http://author.crest.pgsitecore.com/en-us/oral-care-topics/brown-teeth-causesTeeth Whitening Gel vs Whitening Strips,http://author.crest.pgsitecore.com/en-us/oral-care-topics/teeth-whitening-gel-vs-whitening-stripsTeeth Whitening Options Important Things to Consider,http://author.crest.pgsitecore.com/en-us/oral-care-topics/teeth-whitening-options-important-things-to-considerEvolution of the At Home Teeth Whitener,http://author.crest.pgsitecore.com/en-us/oral-care-topics/evolution-of-the-at-home-teeth-whitenerDental Whitening Gel and Teeth Whitening,http://author.crest.pgsitecore.com/en-us/oral-care-topics/dental-whitening-gel-and-teeth-whiteningTooth Stains and Seniors,http://author.crest.pgsitecore.com/en-us/oral-care-topics/tooth-stains-and-seniorsDiscolored Teeth,http://author.crest.pgsitecore.com/en-us/oral-care-topics/discolored-teethCombat Brown Teeth,http://author.crest.pgsitecore.com/en-us/oral-care-topics/combat-brown-teethThe Safety of At Home Teeth Whitening Remedies,http://author.crest.pgsitecore.com/en-us/oral-care-topics/the-safety-of-at-home-teeth-whitening-remediesSifting Through the Many Teeth Whitening Methods,http://author.crest.pgsitecore.com/en-us/oral-care-topics/sifting-through-the-many-teeth-whitening-methodsAt Home Teeth Whitening - More Than a White Bright Smile,http://author.crest.pgsitecore.com/en-us/oral-care-topics/at-home-teeth-whitening---more-than-a-white-bright-smileProfessional Teeth Whitening Kits,http://author.crest.pgsitecore.com/en-us/oral-care-topics/professional-teeth-whitening-kitsTeeth Stain Science,http://author.crest.pgsitecore.com/en-us/oral-care-topics/teeth-stain-scienceDangers of Teeth Whitening,http://author.crest.pgsitecore.com/en-us/oral-care-topics/dangers-of-teeth-whiteningProfessional Teeth Whitening Options,http://author.crest.pgsitecore.com/en-us/oral-care-topics/professional-teeth-whitening-optionsQuick Teeth Whitening Tips,http://author.crest.pgsitecore.com/en-us/oral-care-topics/quick-teeth-whitening-tipsTips for Safe Tooth Whitening,http://author.crest.pgsitecore.com/en-us/oral-care-topics/tips-for-safe-tooth-whiteningDIY Teeth Whitening: Easy and Effective,http://author.crest.pgsitecore.com/en-us/oral-care-topics/diy-teeth-whitening-easy-and-effectiveTeeth Whitening Side Effects,http://author.crest.pgsitecore.com/en-us/oral-care-topics/teeth-whitening-side-effectsHome Teeth Bleaching Is It Safe,http://author.crest.pgsitecore.com/en-us/oral-care-topics/home-teeth-bleaching-is-it-safeHow Can I Find the Best At Home Teeth Whitener,http://author.crest.pgsitecore.com/en-us/oral-care-topics/how-can-i-find-the-best-at-home-teeth-whitenerWhitening Teeth at Home - You Dont Have to Sacrifice Results,http://author.crest.pgsitecore.com/en-us/oral-care-topics/whitening-teeth-at-home---you-dont-have-to-sacrifice-resultsTeeth Bleaching Gel How Does It Work,http://author.crest.pgsitecore.com/en-us/oral-care-topics/teeth-bleaching-gel-how-does-it-workTeeth Stain Removal,http://author.crest.pgsitecore.com/en-us/oral-care-topics/teeth-stain-removalCauses of Yellow Teeth,http://author.crest.pgsitecore.com/en-us/oral-care-topics/causes-of-yellow-teethDental Whitening,http://author.crest.pgsitecore.com/en-us/oral-care-topics/dental-whiteningHome Teeth Whitening Tips for Removing and Preventing Stains,http://author.crest.pgsitecore.com/en-us/oral-care-topics/home-teeth-whitening-tips-for-removing-and-preventing-stainsAvoid the Psychological Toll of Teeth Stains,http://author.crest.pgsitecore.com/en-us/oral-care-topics/avoid-the-psychological-toll-of-teeth-stainsSay Goodbye to Yellow Teeth,http://author.crest.pgsitecore.com/en-us/oral-care-topics/say-goodbye-to-yellow-teethHome Teeth Whitening Kits - When Not to Use,http://author.crest.pgsitecore.com/en-us/oral-care-topics/home-teeth-whitening-kits---when-not-to-useCure Your Coffee Stained Teeth,http://author.crest.pgsitecore.com/en-us/oral-care-topics/cure-your-coffee-stained-teethCause of Gray Teeth,http://author.crest.pgsitecore.com/en-us/oral-care-topics/cause-of-gray-teethHome Teeth Whitening Kits Benefits,http://author.crest.pgsitecore.com/en-us/oral-care-topics/home-teeth-whitening-kits-benefitsBaking Soda and Strawberries for Teeth,http://author.crest.pgsitecore.com/en-us/oral-care-topics/baking-soda-and-strawberries-for-teethHow to Whiten Teeth at Home,http://author.crest.pgsitecore.com/en-us/oral-care-topics/how-to-whiten-teeth-at-homeTeeth Whitening Process Keep It Smile,http://author.crest.pgsitecore.com/en-us/oral-care-topics/teeth-whitening-process-keep-it-smileProfessional Teeth Whitening At Home,http://author.crest.pgsitecore.com/en-us/oral-care-topics/professional-tooth-whitening-at-homeTooth Whitening Kits What to Expect,http://author.crest.pgsitecore.com/en-us/oral-care-topics/tooth-whitening-kits-what-to-expectSensitivity,http://author.crest.pgsitecore.com/en-us/oral-care-topics/sensitivityMake Your Teeth Happy with Sensitive Toothpaste,http://author.crest.pgsitecore.com/en-us/oral-care-topics/make-your-teeth-happy-with-sensitive-toothpasteThe Benefits of Using Sensitive Toothpaste,http://author.crest.pgsitecore.com/en-us/oral-care-topics/the-benefits-of-using-sensitive-toothpasteAcidic Foods Can Contribute to Teeth Sensitivity,http://author.crest.pgsitecore.com/en-us/oral-care-topics/acidic-foods-can-contribute-to-teeth-sensitivityHow to Handle Heat Sensitive Teeth,http://author.crest.pgsitecore.com/en-us/oral-care-topics/how-to-handle-heat-sensitive-teethCauses of Cold Sensitive Teeth,http://author.crest.pgsitecore.com/en-us/oral-care-topics/causes-of-cold-sensitive-teethThe Impact of High Acidic Foods on Your Teeth,http://author.crest.pgsitecore.com/en-us/oral-care-topics/the-impact-of-high-acidic-foods-on-your-teethSensitive Teeth Causes: Do You Brush Too Hard?,http://author.crest.pgsitecore.com/en-us/oral-care-topics/articleReduce Sensitivity with Sensitive Teeth Toothpaste,http://author.crest.pgsitecore.com/en-us/oral-care-topics/reduce-sensitivity-with-sensitive-teeth-toothpasteShould I Worry If My Teeth Have Sensitivity to Cold,http://author.crest.pgsitecore.com/en-us/oral-care-topics/should-i-worry-if-my-teeth-have-sensitivity-to-coldTooth Whitening Sensitivity Can Be Painful,http://author.crest.pgsitecore.com/en-us/oral-care-topics/tooth-whitening-sensitivity-can-be-painfulWhat you Should Know About Sensitive Teeth,http://author.crest.pgsitecore.com/en-us/oral-care-topics/what-you-should-know-about-sensitive-teethTips to Tame a Sensitive Tooth,http://author.crest.pgsitecore.com/en-us/oral-care-topics/tips-to-tame-a-sensitive-toothManage Tooth Sensitivity Safely,http://author.crest.pgsitecore.com/en-us/oral-care-topics/manage-tooth-sensitivity-safelyWhitening For Sensitive Teet,http://author.crest.pgsitecore.com/en-us/oral-care-topics/whitening-for-sensitive-teetDiagnosing Teeth Sensitive to Hot and Cold,http://author.crest.pgsitecore.com/en-us/oral-care-topics/diagnosing-teeth-sensitive-to-hot-and-coldThe Big Chill: Coping with Cold Sensitivity,http://author.crest.pgsitecore.com/en-us/oral-care-topics/the-big-chill-coping-with-cold-sensitivityHelp for Extremely Sensitive Teeth,http://author.crest.pgsitecore.com/en-us/oral-care-topics/help-for-extremely-sensitive-teethWhat Causes Sensitive Teeth,http://author.crest.pgsitecore.com/en-us/oral-care-topics/what-causes-sensitive-teethFinding the Best Toothpaste for Sensitive Teeth,http://author.crest.pgsitecore.com/en-us/oral-care-topics/finding-the-best-toothpaste-for-sensitive-teethStay on Top of Teeth Sensitivity,http://author.crest.pgsitecore.com/en-us/oral-care-topics/stay-on-top-of-teeth-sensitivityWhy Are My Teeth Sensitive to Cold?,http://author.crest.pgsitecore.com/en-us/oral-care-topics/why-are-my-teeth-sensitive-to-coldTeeth Sensitivity,http://author.crest.pgsitecore.com/en-us/oral-care-topics/teeth-sensitivityToothbrushing Technique to Prevent Teeth Sensitivity,http://author.crest.pgsitecore.com/en-us/oral-care-topics/toothbrushing-technique-to-prevent-teeth-sensitivityThe Truth About Acidic and Alkaline Foods,http://author.crest.pgsitecore.com/en-us/oral-care-topics/the-truth-about-acidic-and-alkaline-foodsWays to Reduce Teeth Sensitivity,http://author.crest.pgsitecore.com/en-us/oral-care-topics/ways-to-reduce-teeth-sensitivityCauses of Teeth Whitening Sensitivity,http://author.crest.pgsitecore.com/en-us/oral-care-topics/causes-of-teeth-whitening-sensitivityWhat Makes Teeth Sensitive to Sweets,http://author.crest.pgsitecore.com/en-us/oral-care-topics/what-makes-teeth-sensitive-to-sweetsTooth Decay & Cavities,http://author.crest.pgsitecore.com/en-us/oral-care-topics/cavitiesWhat are the Signs of a Cavity,http://author.crest.pgsitecore.com/en-us/oral-care-topics/what-are-the-signs-of-a-cavityPlaque & Tartar,http://author.crest.pgsitecore.com/en-us/oral-care-topics/plaqueTartar Build Up,http://author.crest.pgsitecore.com/en-us/oral-care-topics/tartar-build-upTartar,http://author.crest.pgsitecore.com/en-us/oral-care-topics/tartarPlaque,http://author.crest.pgsitecore.com/en-us/oral-care-topics/plaqueGingivitis,http://author.crest.pgsitecore.com/en-us/oral-care-topics/gingivitisGingivitis,http://author.crest.pgsitecore.com/en-us/oral-care-topics/gingivitisUnhealthy Gums,http://author.crest.pgsitecore.com/en-us/oral-care-topics/unhealthy-gumsGeneral Oral Hygiene,http://author.crest.pgsitecore.com/en-us/oral-care-topics/general-oral-hygienebrushing teeth for kids,http://author.crest.pgsitecore.com/en-us/oral-care-topics/brushing-teeth-for-kidsBest Practices for Brushing Teeth With Braces,http://author.crest.pgsitecore.com/en-us/oral-care-topics/best-practices-for-brushing-teeth-with-bracesPreventing Tooth Decay,http://author.crest.pgsitecore.com/en-us/oral-care-topics/preventing-tooth-decayFirst-Aid for Bleeding Gums,http://author.crest.pgsitecore.com/en-us/oral-care-topics/first-aid-for-bleeding-gumsGet Help for Severe Tooth Pain,http://author.crest.pgsitecore.com/en-us/oral-care-topics/get-help-for-severe-tooth-painMake Your Teeth Happy with Sensitive Toothpaste,http://author.crest.pgsitecore.com/en-us/oral-care-topics/make-your-teeth-happy-with-sensitive-toothpasteThe Benefits of Using Sensitive Toothpaste,http://author.crest.pgsitecore.com/en-us/oral-care-topics/the-benefits-of-using-sensitive-toothpasteOral Hygiene 101,http://author.crest.pgsitecore.com/en-us/oral-care-topics/oral-hygiene-101Warning Signs of Oral Cancer,http://author.crest.pgsitecore.com/en-us/oral-care-topics/warning-signs-of-oral-cancerTeeth Pain - When you Need a Root Canal,http://author.crest.pgsitecore.com/en-us/oral-care-topics/teeth-pain-when-you-need-a-root-canalWhy Is Tooth Pain after Filling Cavities Common,http://author.crest.pgsitecore.com/en-us/oral-care-topics/why-is-tooth-pain-after-filling-cavities-commonHow to Handle Heat Sensitive Teeth,http://author.crest.pgsitecore.com/en-us/oral-care-topics/how-to-handle-heat-sensitive-teethCauses of Cold Sensitive Teeth,http://author.crest.pgsitecore.com/en-us/oral-care-topics/causes-of-cold-sensitive-teethWhat is Plaque?,http://author.crest.pgsitecore.com/en-us/oral-care-topics/what-is-plaqueGet Kids Excited to Fight Cavities,http://author.crest.pgsitecore.com/en-us/oral-care-topics/get-kids-excited-to-fight-cavitiesEmergency Care for a Missing Tooth,http://author.crest.pgsitecore.com/en-us/oral-care-topics/emergency-care-for-a-missing-toothReducing Wisdom Teeth Swelling,http://author.crest.pgsitecore.com/en-us/oral-care-topics/reducing-wisdom-teeth-swellingTooth Sensitive to Hot Food and Beverages,http://author.crest.pgsitecore.com/en-us/oral-care-topics/tooth-sensitive-to-hot-food-and-beveragesSensitive Teeth Causes: Do You Brush Too Hard?,http://author.crest.pgsitecore.com/en-us/oral-care-topics/articleShould I Worry If My Teeth Have Sensitivity to Cold,http://author.crest.pgsitecore.com/en-us/oral-care-topics/should-i-worry-if-my-teeth-have-sensitivity-to-coldLink between Dental Health and Heart Disease,http://author.crest.pgsitecore.com/en-us/oral-care-topics/link-between-dental-health-and-heart-diseaseWhat you Should Know About Sensitive Teeth,http://author.crest.pgsitecore.com/en-us/oral-care-topics/what-you-should-know-about-sensitive-teethA Brief History of Oral Health What You Should Know,http://author.crest.pgsitecore.com/en-us/oral-care-topics/a-brief-history-of-oral-health-what-you-should-knowDo I Need to Have My Wisdom Teeth Pulled,http://author.crest.pgsitecore.com/en-us/oral-care-topics/do-i-need-to-have-my-wisdom-teeth-pulledThe Right Care for a Cracked Tooth,http://author.crest.pgsitecore.com/en-us/oral-care-topics/the-right-care-for-a-cracked-toothDiagnosing Sinus Gum Pain,http://author.crest.pgsitecore.com/en-us/oral-care-topics/diagnosing-sinus-gum-painDefine Your Dental Pain,http://author.crest.pgsitecore.com/en-us/oral-care-topics/define-your-dental-painDont Ignore Gum Inflammation,http://author.crest.pgsitecore.com/en-us/oral-care-topics/dont-ignore-gum-inflammationWisdom Tooth Pain Causes and Cures,http://author.crest.pgsitecore.com/en-us/oral-care-topics/wisdom-tooth-pain-causes-and-curesHow to Get Rid of Bad Breath,http://author.crest.pgsitecore.com/en-us/oral-care-topics/how-to-get-rid-of-bad-breathWhen to Consider the Removal of Wisdom Teeth,http://author.crest.pgsitecore.com/en-us/oral-care-topics/when-to-consider-the-removal-of-wisdom-teethDiagnosing Teeth Sensitive to Hot and Cold,http://author.crest.pgsitecore.com/en-us/oral-care-topics/diagnosing-teeth-sensitive-to-hot-and-coldHow to Brush Your Teeth,http://author.crest.pgsitecore.com/en-us/oral-care-topics/how-to-brush-your-teethManaging impacted Wisdom Teeth,http://author.crest.pgsitecore.com/en-us/oral-care-topics/managing-impacted-wisdom-teethStopping Tooth Ache Pain,http://author.crest.pgsitecore.com/en-us/oral-care-topics/stopping-tooth-ache-painHelp for Extremely Sensitive Teeth,http://author.crest.pgsitecore.com/en-us/oral-care-topics/help-for-extremely-sensitive-teethThe Process of Removing Wisdom Teeth,http://author.crest.pgsitecore.com/en-us/oral-care-topics/the-process-of-removing-wisdom-teethTriclosan,http://author.crest.pgsitecore.com/en-us/oral-care-topics/triclosanSneaky Sources of Tooth Pain,http://author.crest.pgsitecore.com/en-us/oral-care-topics/sneaky-sources-of-tooth-painWhat to Know about Root Canal Pain,http://author.crest.pgsitecore.com/en-us/oral-care-topics/what-to-know-about-root-canal-painWhat to Expect from a Tooth Extraction,http://author.crest.pgsitecore.com/en-us/oral-care-topics/what-to-expect-from-a-tooth-extractionMajor Causes of Tooth Pain,http://author.crest.pgsitecore.com/en-us/oral-care-topics/major-causes-of-tooth-painWhat is Gingivitis,http://author.crest.pgsitecore.com/en-us/oral-care-topics/what-is-gingivitisBaking Soda for Brushing Teeth - Pros & Cons,http://author.crest.pgsitecore.com/en-us/oral-care-topics/baking-soda-for-brushing-teeth-pros-consSore Gums,http://author.crest.pgsitecore.com/en-us/oral-care-topics/sore-gumsWisdom Teeth Pain Signs and Symptoms,http://author.crest.pgsitecore.com/en-us/oral-care-topics/wisdom-teeth-pain-signs-and-symptomsHealthy Gums Can Help You Have a Healthy Body,http://author.crest.pgsitecore.com/en-us/oral-care-topics/healthy-gums-can-help-you-have-a-healthy-bodySinus Infection Tooth Pain Might Lead to Tooth Decay,http://author.crest.pgsitecore.com/en-us/oral-care-topics/sinus-infection-tooth-pain-might-lead-to-tooth-decayWhy You Need Fluoride,http://author.crest.pgsitecore.com/en-us/oral-care-topics/why-you-need-fluorideFinding the Best Toothpaste for Sensitive Teeth,http://author.crest.pgsitecore.com/en-us/oral-care-topics/finding-the-best-toothpaste-for-sensitive-teethHealthy Gums Can Help You Have a Healthy Body,http://author.crest.pgsitecore.com/en-us/oral-care-topics/healthy-gums-can-help-you-have-a-healthy-bodyOral Care Tips from Dr Sand,http://author.crest.pgsitecore.com/en-us/oral-care-topics/oral-care-tips-from-dr-sandDental Emergencies,http://author.crest.pgsitecore.com/en-us/oral-care-topics/dental-emergenciesGum Disease Symptoms,http://author.crest.pgsitecore.com/en-us/oral-care-topics/gum-disease-symptomsTeeth Sensitivity,http://author.crest.pgsitecore.com/en-us/oral-care-topics/teeth-sensitivityTop Tips for Clean Teeth,http://author.crest.pgsitecore.com/en-us/oral-care-topics/top-tips-for-clean-teethCleaning Teeth Cheat Sheet,http://author.crest.pgsitecore.com/en-us/oral-care-topics/cleaning-teeth-cheat-sheetHints for a Healthy Mouth,http://author.crest.pgsitecore.com/en-us/oral-care-topics/hints-for-a-healthy-mouthTeaching Tools,http://author.crest.pgsitecore.com/en-us/oral-care-topics/teaching-toolsEverything You Need to Know about a Cavity,http://author.crest.pgsitecore.com/en-us/oral-care-topics/everything-you-need-to-know-about-a-cavityWisdom Tooth Removal Tips,http://author.crest.pgsitecore.com/en-us/oral-care-topics/wisdom-tooth-removal-tipsWhat to do for a Chipped Tooth,http://author.crest.pgsitecore.com/en-us/oral-care-topics/what-to-do-for-a-chipped-toothNever Ignore Your Wisdom Teeth Symptoms,http://author.crest.pgsitecore.com/en-us/oral-care-topics/never-ignore-your-wisdom-teeth-symptomsToothbrushing Technique to Prevent Teeth Sensitivity,http://author.crest.pgsitecore.com/en-us/oral-care-topics/toothbrushing-technique-to-prevent-teeth-sensitivityGum Infection - Treatment & Prevention,http://author.crest.pgsitecore.com/en-us/oral-care-topics/gum-infection-treatment-preventionAchieving Wisdom Teeth Pain Relief and Avoiding Infection,http://author.crest.pgsitecore.com/en-us/oral-care-topics/achieving-wisdom-teeth-pain-relief-and-avoiding-infectionWisdom Teeth Surgery What You Should Know,http://author.crest.pgsitecore.com/en-us/oral-care-topics/wisdom-teeth-surgery-what-you-should-knowDental Abscess Awareness What You Need to Know,http://author.crest.pgsitecore.com/en-us/oral-care-topics/dental-abscess-awareness-what-you-need-to-knowHow to Brush Your Teeth,http://author.crest.pgsitecore.com/en-us/oral-care-topics/how-to-brush-your-teethPreventing Tooth Decay by Preventing Dry Mouth,http://author.crest.pgsitecore.com/en-us/oral-care-topics/preventing-tooth-decay-by-preventing-dry-mouthBrushing Your Teeth,http://author.crest.pgsitecore.com/en-us/oral-care-topics/brushing-your-teethFighting Tooth and Gum Pain,http://author.crest.pgsitecore.com/en-us/oral-care-topics/fighting-tooth-and-gum-painThe Importance of Brushing Teeth Properly,http://author.crest.pgsitecore.com/en-us/oral-care-topics/the-importance-of-brushing-teeth-properlyThe Golden Rule of Oral Hygiene - Brush Your Teeth,http://author.crest.pgsitecore.com/en-us/oral-care-topics/the-golden-rule-of-oral-hygiene---brush-your-teethInfected Wisdom Tooth Treatment,http://author.crest.pgsitecore.com/en-us/oral-care-topics/infected-wisdom-tooth-treatmentThe Key to a Healthy Smile Floss Daily,http://author.crest.pgsitecore.com/en-us/oral-care-topics/the-key-to-a-healthy-smile-floss-dailyTooth Pain,http://author.crest.pgsitecore.com/en-us/oral-care-topics/dental-problems-and-solutionsFirst-Aid for Bleeding Gums,http://author.crest.pgsitecore.com/en-us/oral-care-topics/first-aid-for-bleeding-gumsGet Help for Severe Tooth Pain,http://author.crest.pgsitecore.com/en-us/oral-care-topics/get-help-for-severe-tooth-painMake Your Teeth Happy with Sensitive Toothpaste,http://author.crest.pgsitecore.com/en-us/oral-care-topics/make-your-teeth-happy-with-sensitive-toothpasteThe Benefits of Using Sensitive Toothpaste,http://author.crest.pgsitecore.com/en-us/oral-care-topics/the-benefits-of-using-sensitive-toothpasteTeeth Pain - When you Need a Root Canal,http://author.crest.pgsitecore.com/en-us/oral-care-topics/teeth-pain-when-you-need-a-root-canalWhy Is Tooth Pain after Filling Cavities Common,http://author.crest.pgsitecore.com/en-us/oral-care-topics/why-is-tooth-pain-after-filling-cavities-commonHow to Handle Heat Sensitive Teeth,http://author.crest.pgsitecore.com/en-us/oral-care-topics/how-to-handle-heat-sensitive-teethCauses of Cold Sensitive Teeth,http://author.crest.pgsitecore.com/en-us/oral-care-topics/causes-of-cold-sensitive-teethGet Kids Excited to Fight Cavities,http://author.crest.pgsitecore.com/en-us/oral-care-topics/get-kids-excited-to-fight-cavitiesTooth Sensitive to Hot Food and Beverages,http://author.crest.pgsitecore.com/en-us/oral-care-topics/tooth-sensitive-to-hot-food-and-beveragesSensitive Teeth Causes: Do You Brush Too Hard?,http://author.crest.pgsitecore.com/en-us/oral-care-topics/article